{
  "$schema": "https://json-schema.org/draft/2020-12/schema",
  "$id": "https://driftproofhq.com/spec/receipt.schema.json",
  "title": "driftproof receipt",
  "description": "A signed, dated record of running one agent skill's eval suite with and without the skill on one model version, with sampled judge scores and confidence bands. Receipt spec v0.3 — adds transcript auditability (per-sample sha256 hashes + optional transcript retention) and registry/pricing provenance.",
  "type": "object",
  "additionalProperties": false,
  "required": ["schema_version", "skill", "suite", "run", "results", "comparison", "verification_level", "receipt_hash"],
  "properties": {
    "schema_version": {
      "type": "string",
      "const": "0.3"
    },
    "skill": {
      "type": "object",
      "additionalProperties": false,
      "required": ["name", "version", "content_hash"],
      "properties": {
        "name": { "type": "string", "minLength": 1 },
        "version": { "type": "string", "minLength": 1 },
        "content_hash": {
          "type": "string",
          "description": "sha256 (hex) over SKILL.md + all bundled files in canonical path-sorted order.",
          "pattern": "^[a-f0-9]{64}$"
        }
      }
    },
    "suite": {
      "type": "object",
      "additionalProperties": false,
      "required": ["format", "suite_hash", "case_count"],
      "properties": {
        "format": { "type": "string", "const": "agentskills.io/evals" },
        "suite_hash": {
          "type": "string",
          "description": "sha256 (hex) over the canonicalized normalized case list.",
          "pattern": "^[a-f0-9]{64}$"
        },
        "case_count": { "type": "integer", "minimum": 0 }
      }
    },
    "run": {
      "type": "object",
      "additionalProperties": false,
      "required": ["model_id", "surface", "runner_version", "date_utc", "judge", "registry", "transcripts"],
      "properties": {
        "model_id": { "type": "string", "minLength": 1 },
        "model_release_date": {
          "description": "ISO date (YYYY-MM-DD) of the model release if known, else null.",
          "type": ["string", "null"],
          "pattern": "^\\d{4}-\\d{2}-\\d{2}$"
        },
        "surface": { "type": "string", "enum": ["api", "claude-cli"] },
        "runner_version": { "type": "string", "minLength": 1 },
        "date_utc": {
          "type": "string",
          "description": "ISO 8601 UTC timestamp of when the run finished.",
          "pattern": "^\\d{4}-\\d{2}-\\d{2}T\\d{2}:\\d{2}:\\d{2}"
        },
        "registry": {
          "type": "string",
          "description": "Whether model_id resolved in the model registry (config/models.json). 'unregistered' means the run still executed but the model was unknown, so cost estimates used the conservative default price.",
          "enum": ["registered", "unregistered"]
        },
        "transcripts": {
          "type": "string",
          "description": "Transcript retention for this run. 'hashes-only' = only the sha256 hashes in results.cases are kept (the default). 'retained-local' = the raw generations + judge outputs were also written to transcripts/<receipt-id>/ (gitignored by default).",
          "enum": ["retained-local", "hashes-only"]
        },
        "judge": {
          "type": "object",
          "additionalProperties": false,
          "description": "Judge sampling settings for this run.",
          "required": ["samples", "temperature", "sampling"],
          "properties": {
            "samples": { "type": "integer", "minimum": 1, "description": "Judge samples taken per case." },
            "temperature": {
              "type": ["number", "null"],
              "description": "Judge temperature when the surface allows setting it (api -> 0), else null (cli -> surface-controlled)."
            },
            "sampling": {
              "type": "string",
              "description": "How sampling params were controlled, e.g. 'api-temperature-0' or 'surface-controlled'."
            },
            "surface": { "type": "string", "enum": ["api", "claude-cli"] }
          }
        }
      }
    },
    "results": {
      "type": "object",
      "additionalProperties": false,
      "required": ["cases", "aggregates"],
      "properties": {
        "cases": {
          "type": "array",
          "items": {
            "type": "object",
            "additionalProperties": false,
            "required": ["id", "mode", "outcome", "score", "mean", "stddev", "samples", "judge", "generation_hash", "judge_sample_hashes"],
            "properties": {
              "id": { "type": "string", "minLength": 1 },
              "mode": { "type": "string", "enum": ["with_skill", "baseline"] },
              "outcome": {
                "type": "string",
                "description": "borderline = the threshold lies within mean +/- stddev.",
                "enum": ["pass", "fail", "borderline", "score"]
              },
              "score": { "type": "number", "minimum": 0, "maximum": 1, "description": "Alias of mean, kept for v0.1 readers." },
              "mean": { "type": "number", "minimum": 0, "maximum": 1 },
              "stddev": { "type": "number", "minimum": 0, "description": "Sample stddev of the judge samples (raw band half-width)." },
              "samples": {
                "type": "array",
                "items": { "type": "number", "minimum": 0, "maximum": 1 },
                "minItems": 1
              },
              "generation_hash": {
                "type": "string",
                "description": "sha256 (hex) of the raw model generation that was judged for this (case, mode).",
                "pattern": "^[a-f0-9]{64}$"
              },
              "judge_sample_hashes": {
                "type": "array",
                "description": "sha256 (hex) of each raw judge output, one per judge sample. Same length as `samples`.",
                "items": { "type": "string", "pattern": "^[a-f0-9]{64}$" },
                "minItems": 1
              },
              "threshold": { "type": ["number", "null"], "minimum": 0, "maximum": 1 },
              "reason": { "type": "string" },
              "judge": {
                "type": "object",
                "additionalProperties": false,
                "required": ["model_id", "rubric_hash"],
                "properties": {
                  "model_id": { "type": "string", "minLength": 1 },
                  "rubric_hash": { "type": "string", "pattern": "^[a-f0-9]{64}$" }
                }
              }
            }
          }
        },
        "aggregates": {
          "type": "object",
          "additionalProperties": false,
          "required": ["with_skill", "baseline"],
          "properties": {
            "with_skill": { "$ref": "#/$defs/modeAggregate" },
            "baseline": { "$ref": "#/$defs/modeAggregate" }
          }
        }
      }
    },
    "comparison": {
      "type": "object",
      "additionalProperties": false,
      "required": ["with_skill_score", "baseline_score", "delta", "delta_uncertainty"],
      "properties": {
        "with_skill_score": { "type": "number", "minimum": 0, "maximum": 1 },
        "baseline_score": { "type": "number", "minimum": 0, "maximum": 1 },
        "delta": { "type": "number", "minimum": -1, "maximum": 1 },
        "delta_uncertainty": {
          "type": "number",
          "minimum": 0,
          "description": "Combined uncertainty of the delta (quadrature sum of the two aggregate bands)."
        }
      }
    },
    "verification_level": {
      "type": "string",
      "description": "Community verification lattice. FORMAL is reserved/unimplemented in v0.3.",
      "enum": ["UNVERIFIED", "DECLARED", "TESTED"]
    },
    "editorial_reviews": {
      "type": "array",
      "description": "Optional pointers to external one-shot editorial reviews of this skill (context only; not verification evidence).",
      "items": {
        "type": "object",
        "additionalProperties": false,
        "required": ["url", "source", "date"],
        "properties": {
          "url": { "type": "string", "minLength": 1 },
          "source": { "type": "string", "minLength": 1 },
          "date": { "type": "string", "pattern": "^\\d{4}-\\d{2}-\\d{2}$" }
        }
      }
    },
    "receipt_hash": {
      "type": "string",
      "description": "sha256 (hex) of the canonical receipt JSON with this field omitted.",
      "pattern": "^[a-f0-9]{64}$"
    }
  },
  "$defs": {
    "modeAggregate": {
      "type": "object",
      "additionalProperties": false,
      "required": ["case_count", "pass_count", "mean_score", "stddev"],
      "properties": {
        "case_count": { "type": "integer", "minimum": 0 },
        "pass_count": { "type": "integer", "minimum": 0 },
        "borderline_count": { "type": "integer", "minimum": 0 },
        "mean_score": { "type": "number", "minimum": 0, "maximum": 1 },
        "stddev": {
          "type": "number",
          "minimum": 0,
          "description": "Suite dispersion: stddev of the per-case means across the suite. A reported summary stat; the drift headline is driven by per-case band-overlap verdicts, not this band."
        }
      }
    }
  }
}
