{
  "schema_version": "0.3",
  "skill": {
    "name": "git-workflow-and-versioning",
    "version": "0.0.0",
    "content_hash": "c0e9cf58fddf629451e5d6d3a130ca252cea78871b0044e1787d8cc417ad04ef"
  },
  "suite": {
    "format": "agentskills.io/evals",
    "suite_hash": "2f3e8cd66159c1dce708cad6a8a047cd6731438b0808e182a271f471315a0a0c",
    "case_count": 7
  },
  "run": {
    "model_id": "claude-sonnet-4-6",
    "model_release_date": "2026-02-17",
    "surface": "claude-cli",
    "runner_version": "0.3.0",
    "date_utc": "2026-07-30T04:30:22.375Z",
    "registry": "registered",
    "transcripts": "retained-local",
    "judge": {
      "samples": 5,
      "temperature": null,
      "sampling": "surface-controlled",
      "surface": "claude-cli"
    }
  },
  "results": {
    "cases": [
      {
        "id": "commit-message-conventional-type",
        "mode": "with_skill",
        "outcome": "pass",
        "score": 0.856,
        "mean": 0.856,
        "stddev": 0.013416,
        "samples": [
          0.85,
          0.85,
          0.88,
          0.85,
          0.85
        ],
        "generation_hash": "b0127e3394d8b74ec4ef62c0cfb8d9d8a2f22d3182d23b2068dd7e7f133db4a6",
        "judge_sample_hashes": [
          "333122fcb24132e494f52342b719541d3319bee184ee54f06a01b86bb04ce4f7",
          "9a80620c881db86553a7b30c351d4422653553cf71791f0ded0511be4b360ead",
          "d4aa4bad31ab2d9e29d3af7009d89b199b69e093b7e0ce788edbf59d410a74d4",
          "7c0f9e1ad348aca838f4bac67b1ebfff543ba025724072c756322d673e1532a5",
          "e84eb1bd9caab11dc095baeb0b4469e2e56c85955c3ea17785bea9be8be9dad6"
        ],
        "threshold": 0.7,
        "reason": "Correct conventional type, specific subject, and well-structured body that clearly explains the cause (wrong time unit), consequence (premature expiry), and the fix. Exemplary but not exceptional.",
        "judge": {
          "model_id": "claude-haiku-4-5",
          "rubric_hash": "c17f2f214cec220ac31af3cfe88a52393c254cea8f9a94fc16e668f668fa88c3"
        }
      },
      {
        "id": "commit-message-conventional-type",
        "mode": "baseline",
        "outcome": "pass",
        "score": 0.854,
        "mean": 0.854,
        "stddev": 0.008944,
        "samples": [
          0.85,
          0.85,
          0.85,
          0.85,
          0.87
        ],
        "generation_hash": "ab360c5b8767e0c2fc246f082b08396adc1c432a2abdc8020f7bbc950c1222b7",
        "judge_sample_hashes": [
          "fe92c3275fadb772ec2b71075355134ce06dd29fb97d6ef4516255ca0113a583",
          "557aad329e747523a71371e988e2db82092269640fe1ba167f2497c8388abe73",
          "67666ba1c51f6f901fae80bc8c07c41df1a84bac3157819fc15c46ff9acf980e",
          "a4f485c4cf7898c14543429c4560a63f56ba1740c3d07c39399ea6e182070246",
          "9ead9549f703476cf1185dd94d32bf6f4bb073e6157e217e1e5fcfcb4f846927"
        ],
        "threshold": 0.7,
        "reason": "Meets all rubric criteria: conventional `fix:` prefix, specific subject (symptom→intended behavior), body explains cause (unit mismatch) not just diff. Exemplary clarity and maintainer actionability, though math explanation ('24 ms × 3600') is slightly unclear.",
        "judge": {
          "model_id": "claude-haiku-4-5",
          "rubric_hash": "c17f2f214cec220ac31af3cfe88a52393c254cea8f9a94fc16e668f668fa88c3"
        }
      },
      {
        "id": "semver-clean-bump",
        "mode": "with_skill",
        "outcome": "pass",
        "score": 0.86,
        "mean": 0.86,
        "stddev": 0.012247,
        "samples": [
          0.88,
          0.85,
          0.85,
          0.86,
          0.86
        ],
        "generation_hash": "a2b097cbba98c6458b97f98ef52273f354948431cbc905affabb1fd2d760e9a6",
        "judge_sample_hashes": [
          "e468fe2e7e0524df08b2940dc2f560aa2d5faea4a2442c40d3bdbe8ec96bcc7e",
          "0f280e7a1c5c11122d12d48ee6952059b4e2ef16849aed7da2e0c1405a82f3bc",
          "bd2cf848e5b23e1d6b8dc33c7c99a104cfdb1c6422718d904ca5f67449cd794a",
          "b9a69622dd8723d44d1c7d7bfe1b1a9fa8d15712f0c6436bc07413e696774a06",
          "a8fb6d79b15e6e9e56ae65b8bf76ef61d34e2939713fd899bedffd8bab6dee67"
        ],
        "threshold": 0.7,
        "reason": "Correctly classifies optional parameter as MINOR, rules out MAJOR, proposes 2.4.0, and also maps memory leak fix to PATCH.",
        "judge": {
          "model_id": "claude-haiku-4-5",
          "rubric_hash": "4a5916ff39e2b4d5b9860ec84771d424556c81cf0925e37652516f69304a3fde"
        }
      },
      {
        "id": "semver-clean-bump",
        "mode": "baseline",
        "outcome": "pass",
        "score": 0.864,
        "mean": 0.864,
        "stddev": 0.011402,
        "samples": [
          0.86,
          0.85,
          0.86,
          0.88,
          0.87
        ],
        "generation_hash": "538e9dabb2450a037f1c613fe3aa115bc5a1a3b260d7ae471c0868919c6cb91a",
        "judge_sample_hashes": [
          "275ca3c7a481c9146cfe15f0bd8d00ae645050f76c3a4bca9131d6aac95074ae",
          "257979a30f718de1a94999dbeda1eb2480bd3dcef4722b221424be50e39c5eaf",
          "7897a675f24beb825c8ebb2ea6a6fc5c321bb957d2dc885484b3ecede6551491",
          "6b6533eeba9bad6c44714df7f1841dfd96074490a68355a6d00f17575bc81c44",
          "83d173188bdf30cbbe102273f022925cf6e096ec2f98a692597284faf7fdedc5"
        ],
        "threshold": 0.7,
        "reason": "Correctly classifies optional parameter as MINOR, rules out MAJOR, proposes 2.4.0. Exemplary: also correctly maps memory-leak fix to PATCH by skill definitions.",
        "judge": {
          "model_id": "claude-haiku-4-5",
          "rubric_hash": "4a5916ff39e2b4d5b9860ec84771d424556c81cf0925e37652516f69304a3fde"
        }
      },
      {
        "id": "split-into-atomic-commits",
        "mode": "with_skill",
        "outcome": "pass",
        "score": 0.868,
        "mean": 0.868,
        "stddev": 0.008367,
        "samples": [
          0.88,
          0.86,
          0.86,
          0.87,
          0.87
        ],
        "generation_hash": "1c6c10445fd59282dae477bf0eb1f3b646e7cea2b6a7f61f0770394622fdbe27",
        "judge_sample_hashes": [
          "1269a4dae6c19e44fa87222ba4092a5f19555400f5d2e550ad25a2dca6c74b73",
          "05ce9ed2708b6c19ab9d13909a00990f81ec241596fdd754564dd87fedea3d14",
          "16ede0d07936dd9fc7d5c607185aef94fa7dce705bdaab308dedbf8dfba346ad",
          "c8621b54047ab7b375c35d7a573fbb9cbed99b875ab3cdb760e3e7b3c1cc6f08",
          "fba0bd4d1b17ab859155dd7e4cf2b72ab8eec88e104320785206e689dafbc4c0"
        ],
        "threshold": 0.7,
        "reason": "Fully correct: three separate commits, refactor isolated, formatting separate, feature+tests grouped, correct conventional types. Exemplary: orders refactor before feature, rationale explicitly names reviewability and revertability.",
        "judge": {
          "model_id": "claude-haiku-4-5",
          "rubric_hash": "e330958b52d76b5d22c01fead311c482e5e00161dd9c367e403094bd0c19ac3b"
        }
      },
      {
        "id": "split-into-atomic-commits",
        "mode": "baseline",
        "outcome": "pass",
        "score": 0.882,
        "mean": 0.882,
        "stddev": 0.013038,
        "samples": [
          0.87,
          0.9,
          0.88,
          0.89,
          0.87
        ],
        "generation_hash": "09e5b3857342cf8e7edd466647e8e9f5d9c487791357e237802492020733c728",
        "judge_sample_hashes": [
          "1f2a893ff4244bc64937e5394f97e693d5247a0bbb901878837d0d9031a86f4f",
          "0daff370c2e86d8854bc1ed2f2214582ab1f1e61f5f40881774cb3ee67a07bcb",
          "b674caf9ad724eacd186f5cb152b25cfc50e34410f6f190f46705031633f518d",
          "ec7c2c04111318df60249e31abccf4955267782801f368d0a2610c5e43fb9abe",
          "02dd54da515feaeaa394ef08be00807abc17a927722d5742cf6c3c681e603d0a"
        ],
        "threshold": 0.7,
        "reason": "Three separate commits with refactor isolated from feature, formatting separate from behavior, correct conventional types, correct dependency ordering (refactor before feature), and explicit rationale naming bisect/revert/review benefits.",
        "judge": {
          "model_id": "claude-haiku-4-5",
          "rubric_hash": "e330958b52d76b5d22c01fead311c482e5e00161dd9c367e403094bd0c19ac3b"
        }
      },
      {
        "id": "changelog-curated-by-impact",
        "mode": "with_skill",
        "outcome": "pass",
        "score": 0.888,
        "mean": 0.888,
        "stddev": 0.029496,
        "samples": [
          0.88,
          0.94,
          0.87,
          0.87,
          0.88
        ],
        "generation_hash": "7739cd30fddccbe463f938706d873d265379549c54f94307e33f5a88aeb30324",
        "judge_sample_hashes": [
          "4b2d6a559f35ce07aa79b02ec33436ef239e227981810b7d34089f03ae79cc27",
          "391e6750452edf35f570e6b35d3db2ba05477df8cfc55f29fad78b2746ca05d0",
          "956c1944f7205cb026cfdc57377560ecc5686eb22b00459a4fcd7ac2d70c5140",
          "173c130684aa0dc132e28c27d23e50b8cf156415dddbd00831b3e364321d6f9c",
          "288b9e1a0d2da67d2bbc88277dafdacfe5fffe3fd21498b214409ef4eb105b68"
        ],
        "threshold": 0.7,
        "reason": "Correctly grouped by impact category, omits non-user-visible changes, exemplary deprecation entry naming replacement endpoint and migration path.",
        "judge": {
          "model_id": "claude-haiku-4-5",
          "rubric_hash": "a3f7f6d638ae14a768a15bfda476fdcef6fe752bd31a8216025483d1fd48c2c1"
        }
      },
      {
        "id": "changelog-curated-by-impact",
        "mode": "baseline",
        "outcome": "fail",
        "score": 0.352,
        "mean": 0.352,
        "stddev": 0.169027,
        "samples": [
          0.23,
          0.3,
          0.28,
          0.65,
          0.3
        ],
        "generation_hash": "c6927f00c010565afe1eda5035fcbb3ca8ce05be648eae239670b433ad8ff759",
        "judge_sample_hashes": [
          "e2a98f9f470fc8f07fc87f5cd1840ee5261e687e965d79428346d381110a3ea3",